reaction_id	crosstalk_source_module	crosstalk_target_module	type	mechanism	reactants	products	modifiers	pmid	evidence_code	ssc_relevance	quality_flag	string_validation	notes
ssc_crosstalk_001	M1	M2	activation	IFN-I primes dermal fibroblasts toward pro-fibrotic transcriptional state (M1→M2)	IFNB1__ext;IFNA1__ext	fibroblast_proFibrotic__cell			ECO:0000305	IFN priming; modulates TGF-β-driven fibroblast response	no_pmid;eco_weak_305_curator_inference	STRING-not-confirmed: 0/10 pairs ≥ 0.700 (max=0.570)	co-author upgrade
ssc_crosstalk_002	M1	M2	activation	CXCL4 acts directly on dermal fibroblasts (M1→M2 bypass of IFN)	CXCL4__ext	fibroblast_proFibrotic__cell		24382179	ECO:0000270	van Bon 2014 — CXCL4 → fibroblast direct effect		n/a (literature-validated; not tested)	-
ssc_crosstalk_003	M1	M4	activation	IFN-I primes pDC and B-cell class switching (M1→M4)	IFNB1__ext;IFNA1__ext	pDC_activated__cell;BCR_activated__cell			ECO:0000305	IFN-I drives adaptive immune amplification	no_pmid;eco_weak_305_curator_inference	STRING-confirmed: 9/16 pairs ≥ 0.700 (max=0.978)	co-author upgrade
ssc_crosstalk_004	M4	M2	transcription	IL-6 → STAT3 → pro-fibrotic fibroblast transcription (M4→M2; tocilizumab rationale)	IL6__ext	fibroblast_proFibrotic__cell;COL1A1__ext	STAT3__cyto	27156434	ECO:0000270	focuSSced trial supports IL-6R blockade in SSc skin/lung		n/a (literature-validated; not tested)	tocilizumab (Khanna 2016)
ssc_crosstalk_005	M4	M2	transcription	IL-13/STAT6 → ECM transcription in fibroblasts (M4→M2; romilkimab rationale)	IL13__ext	COL1A1__ext;FN1__ecm	STAT6__cyto	17050694	ECO:0000314	direct Th2 → fibroblast ECM pathway		n/a (literature-validated; not tested)	-
ssc_crosstalk_006	M2	M3	state_change	TGF-β1 from M2 drives EndMT in M3 endothelial cells (M2→M3)	TGFB1__ext;SMAD3p_SMAD4__nuc	SNAI1__nuc;CDH5_repressed__pm		17656708	ECO:0000270	canonical EndMT initiator		n/a (literature-validated; not tested)	-
ssc_crosstalk_007	M3	M2	state_change	EndMT-derived perivascular fibroblasts join myofibroblast pool (M3→M2)	CDH2__pm;FAP__pm	phenotype_myofibroblast_activation__cell			ECO:0000305	conceptual bridge; explains perivascular fibrosis distribution	no_pmid;eco_weak_305_curator_inference	STRING-not-confirmed: 0/10 pairs ≥ 0.700 (max=0.652)	-
ssc_crosstalk_008			activation	TGF-β1 → CTGF autocrine amplifier loop within M2	TGFB1__ext	CTGF__ext;fibroblast_proFibrotic__cell		16007098	ECO:0000314	autocrine fibroblast amplifier	module_arrow_unparsed	n/a (literature-validated; not tested)	-
